{
  "$schema_version": 1,
  "description": "Lens augmentation registry. Read by .claude/hooks/context/lens-router.cjs. Each lens has zero or more augmenting moves. Each move has triggers, an attachment point, and a skill path. A move fires when its trigger patterns match the user prompt. Firing injects a directive that tells Claude to invoke the linked skill before responding.",
  "attachment_points": [
    "session_start",
    "during_research",
    "during_define",
    "during_ideate",
    "ideate_to_build",
    "during_build",
    "build_to_test",
    "during_test",
    "during_review",
    "review_to_commit"
  ],
  "lenses": {
    "pm": {
      "description": "Product management. Outcome thinking, risk framing, prioritization, opportunity cost.",
      "moves": [
        {
          "name": "pre-mortem",
          "attachment": "ideate_to_build",
          "triggers": [
            "let's build",
            "lets build",
            "ready to build",
            "ready to implement",
            "i'm about to build",
            "im about to build",
            "i'm about to start building",
            "im about to start building",
            "i'm about to ship",
            "im about to ship",
            "start building",
            "commit to this",
            "locking this in",
            "ready to ship"
          ],
          "skill": "pre-mortem"
        }
      ]
    },
    "ux": {
      "description": "User experience and human-computer interaction. User needs, usability, research synthesis.",
      "moves": [
        {
          "name": "heuristic-scan",
          "attachment": "during_review",
          "triggers": [
            "ready for review",
            "looks good to me",
            "does this feel right",
            "usability check",
            "heuristic pass",
            "any ux issues",
            "before i ship this ux"
          ],
          "skill": "heuristic-scan"
        },
        {
          "name": "trunk-test",
          "attachment": "during_test",
          "triggers": [
            "does this make sense",
            "is this clear",
            "can someone use this",
            "first-time user",
            "new to this",
            "pretend you don't know",
            "cold read",
            "six months from now",
            "fresh eyes"
          ],
          "skill": "trunk-test"
        },
        {
          "name": "assumption-reframe",
          "attachment": "during_research",
          "triggers": [
            "let's research",
            "look into",
            "figure out why",
            "what do users want",
            "what should this do",
            "user needs",
            "the problem is",
            "what we want to know",
            "the goal is"
          ],
          "skill": "assumption-reframe"
        }
      ]
    },
    "design": {
      "description": "Visual and interaction design craft. Typography, hierarchy, motion, composition.",
      "moves": [
        {
          "name": "reference-triangulation",
          "attachment": "during_ideate",
          "triggers": [
            "let's set the direction",
            "lets set the direction",
            "what should this look like",
            "let's pick a style",
            "lets pick a style",
            "going for a vibe",
            "design direction",
            "pick references",
            "visual direction",
            "what's the feel",
            "whats the feel"
          ],
          "skill": "reference-triangulation"
        },
        {
          "name": "type-specimen",
          "attachment": "ideate_to_build",
          "triggers": [
            "pick a font",
            "font pairing",
            "lock the typography",
            "set the type",
            "choose a font",
            "typography direction",
            "commit to the font",
            "go with inter",
            "go with this font"
          ],
          "skill": "type-specimen"
        },
        {
          "name": "affordance-audit",
          "attachment": "during_test",
          "triggers": [
            "is this clear",
            "is this obvious",
            "will users know",
            "discoverability",
            "affordance",
            "can they tell",
            "does this look clickable",
            "how do they know",
            "test the ui",
            "try the ui",
            "walk through the ui",
            "wire this up",
            "connect the ui",
            "make this clickable",
            "hook up the trigger",
            "let the user",
            "add a flag",
            "add a command",
            "add a hook",
            "interactive",
            "ui is ready"
          ],
          "skill": "affordance-audit"
        },
        {
          "name": "hierarchy-squint",
          "attachment": "during_review",
          "triggers": [
            "review the design",
            "is the hierarchy right",
            "does this read",
            "feels flat",
            "everything looks the same",
            "does this have hierarchy",
            "what stands out"
          ],
          "skill": "hierarchy-squint"
        }
      ]
    },
    "engineering": {
      "description": "Systems architecture, trade-offs, failure modes, implementation judgment.",
      "moves": [
        {
          "name": "boring-check",
          "attachment": "during_ideate",
          "triggers": [
            "let's use",
            "lets use",
            "we could use",
            "add a library",
            "pull in",
            "new dependency",
            "switch to",
            "migrate to",
            "rewrite in",
            "use a framework"
          ],
          "skill": "boring-check"
        },
        {
          "name": "reversibility-classify",
          "attachment": "ideate_to_build",
          "triggers": [
            "let's go with",
            "lets go with",
            "we'll use",
            "well use",
            "locking in",
            "final answer",
            "decision is",
            "going with",
            "committing to the approach",
            "final call",
            "shape of this",
            "architecture is"
          ],
          "skill": "reversibility-classify"
        },
        {
          "name": "chesterton-audit",
          "attachment": "during_build",
          "triggers": [
            "delete this",
            "remove this",
            "clean up",
            "why is this here",
            "looks unused",
            "can we drop",
            "dead code",
            "strip out",
            "refactor away",
            "rewrite this",
            "redo this"
          ],
          "skill": "chesterton-audit"
        },
        {
          "name": "observable-surface-audit",
          "attachment": "during_review",
          "triggers": [
            "change the output",
            "change the format",
            "update the schema",
            "change the trigger",
            "update the config",
            "bump the version",
            "breaking change",
            "this is internal",
            "downstream will be fine",
            "sync the kit"
          ],
          "skill": "observable-surface-audit"
        },
        {
          "name": "drift-check",
          "triggers": [
            "this is drift",
            "looks like drift",
            "is this drift",
            "outlier",
            "inconsistent with",
            "normalize this",
            "normalize these",
            "align with the others",
            "align with the rest",
            "the others use",
            "matches the pattern"
          ],
          "skill": "drift-check"
        }
      ]
    },
    "systems-thinking": {
      "description": "Feedback loops, emergence, second-order effects, leverage points.",
      "moves": [
        {
          "name": "second-order-check",
          "attachment": "ideate_to_build",
          "triggers": [
            "quick fix",
            "just add a",
            "one more hook",
            "just patch it",
            "band-aid",
            "bandaid",
            "workaround",
            "add a check",
            "add a guard",
            "hotfix",
            "i'll just",
            "ill just"
          ],
          "skill": "second-order-check"
        },
        {
          "name": "leverage-point-scan",
          "attachment": "during_ideate",
          "triggers": [
            "how should we fix",
            "what's the right intervention",
            "whats the right intervention",
            "best place to fix",
            "where should this live",
            "tweak the value",
            "change the default",
            "adjust the threshold",
            "add a rule",
            "change the config",
            "bump the timeout"
          ],
          "skill": "leverage-point-scan"
        },
        {
          "name": "symptom-vs-root",
          "attachment": "during_define",
          "triggers": [
            "something's off",
            "somethings off",
            "this keeps happening",
            "weird behavior",
            "not sure why",
            "intermittent",
            "flaky",
            "happens sometimes",
            "recurring",
            "still broken",
            "still happening"
          ],
          "skill": "symptom-vs-root"
        }
      ]
    },
    "data-science": {
      "description": "Evidence over opinion. Measurement, causal inference, data quality.",
      "moves": [
        {
          "name": "name-the-metric",
          "attachment": "during_define",
          "triggers": [
            "the data shows",
            "the data says",
            "what does the data say",
            "the numbers say",
            "usage is up",
            "usage is down",
            "activation rate",
            "retention is",